judul,link,desc,tanggal,kategori,keyword
Video: Pramono Anung Ogah Tiru Dedi Mulyadi Kirim Siswa Nakal ke Barak TNI,https://20.detik.com/detikupdate/20250503-250503086/video-pramono-anung-ogah-tiru-dedi-mulyadi-kirim-siswa-nakal-ke-barak-tni,Gubernur DKI Jakarta Pramono Anung mengaku tak mau mengikuti langkah Gubernur Jawa Barat Dedi Mulyadi mengirim siswa nakal ke barak militer.,"Sabtu, 03 Mei  2025 21:37 WIB",detikNews,Dedi Mulyadi kirim siswa nakal
Zaini Shofari Minta Pembatasan Jam Malam Pelajar Libatkan Polisi,https://www.detik.com/jabar/berita/d-7934892/zaini-shofari-minta-pembatasan-jam-malam-pelajar-libatkan-polisi,"Anggota DPRD Jabar Zaini Shofari dukung pembatasan jam malam untuk pelajar, namun minta pengawasan lebih ketat melibatkan kepolisian dan orang tua.",11 jam yang lalu,detikJabar,Dedi Mulyadi kirim siswa nakal
Blak-Blakan Dedi Mulyadi soal Kirim Anak Nakal ke Markas TNI,https://www.detik.com/jabar/berita/d-7895715/blak-blakan-dedi-mulyadi-soal-kirim-anak-nakal-ke-markas-tni,Gubernur Dedi Mulyadi kirim siswa nakal di Jawa Barat ke markas TNI untuk pendidikan karakter. Kebijakan ini bertujuan mendidik siswa yang sulit di rumah.,"Jumat, 02 Mei  2025 12:00 WIB",detikJabar,Dedi Mulyadi kirim siswa nakal
Kata Menko PMK Soal Kebijakan Anak Nakal Dikirim ke Barak Militer,https://www.detik.com/jatim/berita/d-7918739/kata-menko-pmk-soal-kebijakan-anak-nakal-dikirim-ke-barak-militer,Menteri Koordinator Bidang Pembangunan Manusia dan Kebudayaan (Menko PMK) Pratikno buka suara terkait kebijakan anak nakal dikirim ke barak. Beginikatanya.,"Sabtu, 17 Mei  2025 17:00 WIB",detikJatim,Dedi Mulyadi kirim siswa nakal
"658 Ribu Anak Putus Sekolah, Fraksi PPP Minta Dedi Mulyadi Turun Tangan",https://www.detik.com/jabar/berita/d-7928390/658-ribu-anak-putus-sekolah-fraksi-ppp-minta-dedi-mulyadi-turun-tangan,Provinsi Jabar menghadapi ironi dengan 658 ribu anak tidak bersekolah. Anggota DPRD Jabar mendesak pemerintah fokus pada solusi substansial untuk masalah ini.,"Jumat, 23 Mei  2025 15:00 WIB",detikJabar,Dedi Mulyadi kirim siswa nakal
Kata Farabi A Rafiq soal Pendidikan Karakter Siswa di Jabar,https://www.detik.com/jabar/berita/d-7927590/kata-farabi-a-rafiq-soal-pendidikan-karakter-siswa-di-jabar,"Anggota DPRD Jabar, Farabi A. Rafiq, dukung Gubernur Dedi Mulyadi dalam pendidikan karakter untuk siswa nakal. Ia minta kurikulum dibakukan.","Kamis, 22 Mei  2025 20:16 WIB",detikJabar,Dedi Mulyadi kirim siswa nakal
Kata Raffi Ahmad Saat Rafathar Ngadu ke KDM soal Nagita Slavina Susah Mandi,https://hot.detik.com/celeb/d-7914445/kata-raffi-ahmad-saat-rafathar-ngadu-ke-kdm-soal-nagita-slavina-susah-mandi,"Raffi Ahmad menjelaskan tentang Nagita Slavina yang disebut susah mandi oleh putra mereka, Rafathar. Keduanya berbagi momen lucu dan interaksi keluarga.","Rabu, 14 Mei  2025 22:01 WIB",detikHot,Dedi Mulyadi kirim siswa nakal
"Belajar di Barak TNI, Siswa Purwakarta Janji Tak 'Nakal' Lagi",https://www.detik.com/jabar/berita/d-7927427/belajar-di-barak-tni-siswa-purwakarta-janji-tak-nakal-lagi,"Dua siswa yang menjalani pendidikan karakter di barak TNI, pulang dengan banyak pelajaran berharga dan perubahan positif dalam disiplin dan ibadah.","Jumat, 23 Mei  2025 05:30 WIB",detikJabar,Dedi Mulyadi kirim siswa nakal
Legislator PDIP Kritik Dedi Mulyadi Kirim Siswa Bermasalah ke Barak,https://news.detik.com/berita/d-7892452/legislator-pdip-kritik-dedi-mulyadi-kirim-siswa-bermasalah-ke-barak,"Anggota Komisi X DPR RI Fraksi PDI Perjuangan, Bonnie Triyana, menyoroti rencana pengiriman siswa bermasalah ke barak militer yang menjadi program Dedi Mulyadi.","Rabu, 30 Apr 2025 09:04 WIB",detikNews,Dedi Mulyadi kirim siswa nakal
"Dedi Mulyadi Hendak Kirim Siswa Bermasalah ke Barak, Mendikdasmen: No Comment",https://news.detik.com/berita/d-7893897/dedi-mulyadi-hendak-kirim-siswa-bermasalah-ke-barak-mendikdasmen-no-comment,Mu'ti pun mengatakan belum ada komunikasi Dedi Mulyadi dengan pemerintah pusat terkait wacana programnya tersebut.,"Rabu, 30 Apr 2025 20:34 WIB",detikNews,Dedi Mulyadi kirim siswa nakal
"Video Dedi Mulyadi soal Siswa Nakal Dikirim ke Barak, Mendikdasmen: No Comment",https://20.detik.com/detikupdate/20250430-250430122/video-dedi-mulyadi-soal-siswa-nakal-dikirim-ke-barak-mendikdasmen-no-comment,Mendikdasmen Abdul Mu'ti enggan menanggapi saran Gubernur Jawa Barat Dedi Mulyadi soal siswa nakal dikirim ke barak TNI/Polri untuk didisiplinkan.,"Rabu, 30 Apr 2025 17:33 WIB",detikEdu,Dedi Mulyadi kirim siswa nakal
"Nagita Slavina Susah Mandi-Main HP Terus, Rafathar Ngadu ke KDM",https://hot.detik.com/celeb/d-7911942/nagita-slavina-susah-mandi-main-hp-terus-rafathar-ngadu-ke-kdm,"Rafathar mengadu ke Gubernur Dedi Mulyadi tentang ibunya, Nagita Slavina, yang susah mandi dan terlalu banyak main HP. Momen lucu ini jadi viral!","Selasa, 13 Mei  2025 14:55 WIB",detikHot,Dedi Mulyadi kirim siswa nakal
Respons Dasco soal Dedi Mulyadi Mau Kirim Siswa Bermasalah ke Barak,https://www.detik.com/jabar/berita/d-7893433/respons-dasco-soal-dedi-mulyadi-mau-kirim-siswa-bermasalah-ke-barak,Gubernur Jabar Dedi Mulyadi wacanakan pendidikan karakter untuk siswa nakal di barak militer. DPR RI minta kaji ulang rencana tersebut.,"Rabu, 30 Apr 2025 16:43 WIB",detikJabar,Dedi Mulyadi kirim siswa nakal
Ade Fitrie Kirana Kritisi Usulan Wajib Militer Untuk Anak Nakal,https://hot.detik.com/celeb/d-7917229/ade-fitrie-kirana-kritisi-usulan-wajib-militer-untuk-anak-nakal,Ade Fitrie Kirana menanggapi usulan wajib militer untuk anak nakal di Jawa Barat. Ia menekankan pentingnya pendekatan pendidikan yang holistik dan penuh kasih.,"Jumat, 16 Mei  2025 15:45 WIB",detikHot,Dedi Mulyadi kirim siswa nakal
Dasco Minta Dedi Mulyadi Kaji Matang Wacana Kirim Siswa Bermasalah ke Barak,https://news.detik.com/berita/d-7893129/dasco-minta-dedi-mulyadi-kaji-matang-wacana-kirim-siswa-bermasalah-ke-barak,Dasco belum mengetahui jelas perihal wacana Gubernur Jabar Dedi Mulyadi mengirim siswa bermasalah ke barak TNI. Dasco meminta wacana itu dikaji matang.,"Rabu, 30 Apr 2025 14:46 WIB",detikNews,Dedi Mulyadi kirim siswa nakal
Al Haris Masih Mengkaji Soal Anak Nakal Dikirim ke Barak Militer,https://www.detik.com/sumbagsel/berita/d-7913373/al-haris-masih-mengkaji-soal-anak-nakal-dikirim-ke-barak-militer,Al Haris menyebut masih mengkaji kemungkinan mengirim anak nakal di Jambi ke barak militer.,"Rabu, 14 Mei  2025 14:00 WIB",detikSumbagsel,Dedi Mulyadi kirim siswa nakal
Anggota DPR Kritik Wacana Dedi Mulyadi Kirim Siswa Bermasalah ke Barak TNI,https://www.detik.com/sumut/berita/d-7892479/anggota-dpr-kritik-wacana-dedi-mulyadi-kirim-siswa-bermasalah-ke-barak-tni,"Gubernur Jabar wacanakan kirim siswa bermasalah ke barak TNI untuk pendidikan karakter. Kritikan muncul, menyebut pendekatan militeristik kurang tepat.","Rabu, 30 Apr 2025 09:50 WIB",detikSumut,Dedi Mulyadi kirim siswa nakal
Kritik Wakil Ketua DPD RI soal Siswa 'Nakal' Dimasukkan Barak Militer,https://www.detik.com/kalimantan/berita/d-7910397/kritik-wakil-ketua-dpd-ri-soal-siswa-nakal-dimasukkan-barak-militer,Wakil Ketua DPD RI Tamsil Linrung berkomentar soal kebijakan Gubernur Jawa Barat Dedi Mulyadi siswa yang dikategorikan nakal dimasukkan barak militer.,"Minggu, 11 Mei  2025 23:51 WIB",detikKalimantan,Dedi Mulyadi kirim siswa nakal
"Bukan Kirim ke Barak Militer, Ini Cara Jakarta Tangani Anak Nakal",https://news.detik.com/berita/d-7911952/bukan-kirim-ke-barak-militer-ini-cara-jakarta-tangani-anak-nakal,Jakarta memutuskan tak mengikuti kebijakan memasukkan anak-anak nakal ke barak militer. Jakarta menyatakan memiliki kebijakan sendiri.,"Selasa, 13 Mei  2025 10:35 WIB",detikNews,Dedi Mulyadi kirim siswa nakal
Warga Jabar Pembuat Onar Akan Dikirim ke Barak Militer Mulai Juni,https://www.detik.com/jabar/berita/d-7909570/warga-jabar-pembuat-onar-akan-dikirim-ke-barak-militer-mulai-juni,Gubernur Jabar Dedi Mulyadi akan perluas program pendidikan karakter untuk warga dewasa. Warga pembuat onar akan dikirim ke barak militer mulai Juni 2025.,"Minggu, 11 Mei  2025 12:30 WIB",detikJabar,Dedi Mulyadi kirim siswa nakal
Komentar Kak Seto Usai Tinjau Barak TNI Tempat Pendidikan Karakter,https://www.detik.com/jabar/berita/d-7909962/komentar-kak-seto-usai-tinjau-barak-tni-tempat-pendidikan-karakter,"Kak Seto meninjau pendidikan karakter di Dodik Bela Negara, Lembang. Ia memastikan hak anak terjaga dan program ini memberikan manfaat positif bagi siswa.","Minggu, 11 Mei  2025 20:30 WIB",detikJabar,Dedi Mulyadi kirim siswa nakal
"Soal Kebijakan Anak Dikirim ke Barak, Pakar Pendidikan: Anak Bisa Trauma",https://www.detik.com/edu/edutainment/d-7909828/soal-kebijakan-anak-dikirim-ke-barak-pakar-pendidikan-anak-bisa-trauma,"Pakar pendidikan UM Surabaya menilai kebijakan anak dikirim ke barak militer cenderung problematik. Menurutnya, ini dapat berdampak buruk pada masa depan anak.","Senin, 12 Mei  2025 11:00 WIB",detikEdu,Dedi Mulyadi kirim siswa nakal
Menaker Buka Suara soal Aksi Ormas di Kawasan Industri,https://finance.detik.com/berita-ekonomi-bisnis/d-7818685/menaker-buka-suara-soal-aksi-ormas-di-kawasan-industri,Menteri Ketenagakerjaan (Menaker) Yassierli merespons tentang aksi Organisasi Masyarakat (ormas) yang diduga memalak pengusaha di kawasan Industri,"Selasa, 11 Mar 2025 22:17 WIB",detikFinance,Dedi Mulyadi kirim siswa nakal
Dedi Mulyadi Ingin 'Sekolahkan' Siswa Nakal ke Markas Militer,https://www.detik.com/jabar/berita/d-7891203/dedi-mulyadi-ingin-sekolahkan-siswa-nakal-ke-markas-militer,"Gubernur Jabar Dedi Mulyadi rencanakan pendidikan karakter untuk siswa bermasalah, melibatkan TNI Polri mulai 2 Mei 2025. Hal ini menuai respons dari DPRD.","Selasa, 29 Apr 2025 13:39 WIB",detikJabar,Dedi Mulyadi kirim siswa nakal
Video: Rencana Komisi X Panggil Kemdikdasmen Buntut Kebijakan 'Barak Militer' Dedi Mulyadi,https://20.detik.com/detikupdate/20250506-250506056/video-rencana-komisi-x-panggil-kemdikdasmen-buntut-kebijakan-barak-militer-deddy-mulyadi,Gubernur Jawa Barat Dedi Mulyadi mencanangkan program kirim siswa nakal ke barak militer. Begini respons Komisi X DPR RI.,"Selasa, 06 Mei  2025 08:27 WIB",detikEdu,Dedi Mulyadi kirim siswa nakal
Video Komisi X DPR Khawatir Kebijakan Kirim Siswa ke Barak Belum Matang,https://20.detik.com/detikupdate/20250506-250506061/video-komisi-x-dpr-khawatir-kebijakan-kirim-siswa-ke-barak-belum-matang,Wakil Ketua Komisi X DPR RI MY Esti Wijayati ungkap kekhawatirannya terhadap kebijakan Gubernur Jawa Barat Dedi Mulyadi yang kirim siswa nakal ke barak militer.,"Selasa, 06 Mei  2025 09:10 WIB",detikNews,Dedi Mulyadi kirim siswa nakal
Pusdikpom-Pusdikarmed Jadi Tempat Pembinaan Siswa Nakal di Cimahi,https://www.detik.com/jabar/berita/d-7902005/pusdikpom-pusdikarmed-jadi-tempat-pembinaan-siswa-nakal-di-cimahi,Pemerintah Cimahi siapkan dua pusat pendidikan militer untuk siswa nakal. Program ini bertujuan mendidik karakter dan kedisiplinan anak bermasalah.,"Selasa, 06 Mei  2025 20:30 WIB",detikJabar,Dedi Mulyadi kirim siswa nakal
"Siap-siap, Pendidikan Karakter di Barak TNI Bakal Menyasar Orang Dewasa",https://www.detik.com/edu/detikpedia/d-7903910/siap-siap-pendidikan-karakter-di-barak-tni-bakal-menyasar-orang-dewasa,"Gubernur Jawa Barat pendidikan karakter ke depannya tak hanya menyasar siswa dan remaja, tapi juga orang dewasa. Begini konsepnya.","Rabu, 07 Mei  2025 18:30 WIB",detikEdu,Dedi Mulyadi kirim siswa nakal
Respons ESI Jabar soal Pemain Game Online Dikirim ke Barak,https://www.detik.com/jabar/berita/d-7903683/respons-esi-jabar-soal-pemain-game-online-dikirim-ke-barak,"Gubernur Jabar Dedi Mulyadi bawa siswa nakal ke TNI untuk pendidikan karakter. ESI Jabar dukung, namun tekankan tidak semua gamer nakal.","Rabu, 07 Mei  2025 23:30 WIB",detikJabar,Dedi Mulyadi kirim siswa nakal
Mengintip Pendidikan Karakter Ala Militer Inisiatif Gubernur Jabar Dedi Mulyadi,https://www.detik.com/edu/detikpedia/d-7903885/mengintip-pendidikan-karakter-ala-militer-inisiatif-gubernur-jabar-dedi-mulyadi,Gubernur Jawa Barat mengirimkan ratusan siswa yang dianggap nakal ke barak militer. Apa saja yang diajarkan di sana? Simak di sini.,"Rabu, 07 Mei  2025 16:30 WIB",detikEdu,Dedi Mulyadi kirim siswa nakal
"Anggaran Pendidikan Karakter di Barak Militer Capai Rp 6 M, Begini Tanggapan DPRD Jabar",https://www.detik.com/edu/edutainment/d-7903898/anggaran-pendidikan-karakter-di-barak-militer-capai-rp-6-m-begini-tanggapan-dprd-jabar,"Gubernur Jawa Barat mengirimkan ratusan siswa yang dianggap nakal ke barak militer. Habiskan APDB sampai Rp6 M, begini tanggapan DPRD setempat.","Rabu, 07 Mei  2025 17:30 WIB",detikEdu,Dedi Mulyadi kirim siswa nakal
Video Pigai Dukung 'Barak Militer' Dedi Mulyadi: Tak Langgar HAM,https://20.detik.com/detikupdate/20250506-250506114/video-pigai-dukung-barak-militer-dedi-mulyadi-tak-langgar-ham,Menteri Hak Asasi Manusia (HAM) menilai kebijakan Gubernur Jawa Barat (Jabar) Dedi Mulyadi yang mengirimkan siswa nakal ke barak militer tak melanggar HAM.,"Selasa, 06 Mei  2025 16:56 WIB",detikNews,Dedi Mulyadi kirim siswa nakal
"Video Komnas HAM Nilai Barak Militer Tak Tepat, Menteri HAM Bilang Begini",https://20.detik.com/detikupdate/20250506-250506128/video-komnas-ham-nilai-barak-militer-tak-tepat-menteri-ham-bilang-begini,Ketua Komnas HAM Atnike Nova Sigiro menilai kebijakan Gubernur Jawa Barat Dedi Mulyadi mengirim siswa nakal ke barak TNI tidaklah tepat. Menham bilang begini.,"Selasa, 06 Mei  2025 19:02 WIB",detikNews,Dedi Mulyadi kirim siswa nakal
Dedi Mulyadi Beri Kuda ke Siswa Bermasalah di Sumedang,https://www.detik.com/jabar/berita/d-7907753/dedi-mulyadi-beri-kuda-ke-siswa-bermasalah-di-sumedang,Puluhan siswa bermasalah di Sumedang dikirim ke barak TNI. Program ini melibatkan orangtua dan bertujuan membentuk karakter positif.,"Jumat, 09 Mei  2025 20:30 WIB",detikJabar,Dedi Mulyadi kirim siswa nakal
Kata Bupati Dadang soal Siswa Nakal Dikirim ke Markas TNI,https://www.detik.com/jabar/berita/d-7905791/kata-bupati-dadang-soal-siswa-nakal-dikirim-ke-markas-tni,Bupati Bandung Dadang Supriatna mendukung pengiriman siswa nakal ke TNI dan mengusulkan penguatan Pancasila melalui penataran P4 untuk pembentukan karakter.,"Kamis, 08 Mei  2025 20:15 WIB",detikJabar,Dedi Mulyadi kirim siswa nakal
"Soal Siswa 'Nakal' Masuk Barak Militer, Pakar UGM: Solutif tapi Tampak Tergesa-gesa",https://www.detik.com/edu/sekolah/d-7902538/soal-siswa-nakal-masuk-barak-militer-pakar-ugm-solutif-tapi-tampak-tergesa-gesa,"Pakar UGM, Dr Subarsono menilai pengiriman siswa nakal ke barak militer seperti kebijakan yang tampak tergesa-gesa. Ini alasannya.","Selasa, 06 Mei  2025 18:00 WIB",detikEdu,Dedi Mulyadi kirim siswa nakal
Respons Menteri Abdul Mu'ti soal Program Sekolah Barak Gagasan Dedi Mulyadi,https://www.detik.com/bali/berita/d-7905749/respons-menteri-abdul-muti-soal-program-sekolah-barak-gagasan-dedi-mulyadi,Mendikdasmen Abdul Mu'ti enggan berkomentar tentang kebijakan Gubernur Jabar Dedi Mulyadi yang mengirim siswa bermasalah ke barak militer. Begini katanya.,"Kamis, 08 Mei  2025 15:43 WIB",detikBali,Dedi Mulyadi kirim siswa nakal
Respons Pakar hingga KemenHAM soal Siswa 'Nakal' Dikirim ke Barak TNI,https://www.detik.com/jabar/berita/d-7901803/respons-pakar-hingga-kemenham-soal-siswa-nakal-dikirim-ke-barak-tni,"Gubernur Jabar Dedi Mulyadi kirim siswa nakal ke barak TNI untuk pendidikan karakter. Kebijakan ini menuai pro dan kontra, perlu melibatkan banyak pihak.","Selasa, 06 Mei  2025 14:30 WIB",detikJabar,Dedi Mulyadi kirim siswa nakal
Blak-Blakan Dedi Mulyadi soal Program Pendidikan Karakter di Markas TNI,https://www.detik.com/jabar/berita/d-7903400/blak-blakan-dedi-mulyadi-soal-program-pendidikan-karakter-di-markas-tni,Gubernur Jabar Dedi Mulyadi meluncurkan program pendidikan karakter untuk siswa nakal di barak TNI. Program ini bertujuan mengubah perilaku negatif siswa.,"Rabu, 07 Mei  2025 11:13 WIB",detikJabar,Dedi Mulyadi kirim siswa nakal
Siap-siap! Siswa Jabar yang Kecanduan Game-Rokok Dikirim ke Barak Militer,https://www.detik.com/jabar/berita/d-7899011/siap-siap-siswa-jabar-yang-kecanduan-game-rokok-dikirim-ke-barak-militer,Gubernur Jabar Dedi Mulyadi kirim siswa berperilaku menyimpang ke barak militer untuk pendidikan karakter. Ini kenakalan yang mereka lakukan.,"Senin, 05 Mei  2025 09:30 WIB",detikJabar,Dedi Mulyadi kirim siswa nakal
TNI AD Hormati Kritik soal Siswa Nakal Dikirim ke Barak Militer,https://news.detik.com/berita/d-7899424/tni-ad-hormati-kritik-soal-siswa-nakal-dikirim-ke-barak-militer,Brigjen Wahyu Yudhayana akan mengevaluasi segala saran dan masukan dari semua pihak. Dia menghormati kritikan pembinaan siswa oleh TNI.,"Senin, 05 Mei  2025 05:39 WIB",detikNews,Dedi Mulyadi kirim siswa nakal
DPRD Jabar Soroti Pendidikan Karakter yang Habiskan Anggaran Rp 6 M,https://www.detik.com/jabar/berita/d-7902078/dprd-jabar-soroti-pendidikan-karakter-yang-habiskan-anggaran-rp-6-m,Program pendidikan karakter Gubernur Jabar Dedi Mulyadi menuai kritik DPRD. Anggaran Rp6 miliar untuk 2.000 siswa dianggap tidak melibatkan DPRD.,"Selasa, 06 Mei  2025 14:47 WIB",detikJabar,Dedi Mulyadi kirim siswa nakal
Catatan DPRD Kota Bandung soal Program Siswa Nakal Dikirim ke Barak,https://www.detik.com/jabar/berita/d-7908861/catatan-dprd-kota-bandung-soal-program-siswa-nakal-dikirim-ke-barak,"Ketua Komisi I DPRD Bandung, Radea Respati, menilai program pengiriman siswa nakal ke barak militer tidak adil dan melanggar hak anak.","Sabtu, 10 Mei  2025 20:30 WIB",detikJabar,Dedi Mulyadi kirim siswa nakal
Daftar 'Kenakalan' Siswa Jabar yang Masuk Barak Militer: Game-Tawuran,https://www.detik.com/jabar/berita/d-7898750/daftar-kenakalan-siswa-jabar-yang-masuk-barak-militer-game-tawuran,Gubernur Jabar Dedi Mulyadi kirim siswa nakal ke barak TNI untuk pendidikan karakter. Ini daftar 'kenakalan' yang bisa buat siswa dikirim ke barak militer.,"Minggu, 04 Mei  2025 14:01 WIB",detikJabar,Dedi Mulyadi kirim siswa nakal
"Kritik Gagasan KDM soal Vasektomi Syarat Bansos, Ono: Gimik Agar Viral",https://www.detik.com/jabar/berita/d-7899676/kritik-gagasan-kdm-soal-vasektomi-syarat-bansos-ono-gimik-agar-viral,Gubernur Jabar Dedi Mulyadi mendapat kritik dari DPRD terkait usulan vasektomi sebagai syarat bansos. Ono Surono menilai kebijakan ini melampaui kewenangan.,"Senin, 05 Mei  2025 12:30 WIB",detikJabar,Dedi Mulyadi kirim siswa nakal
Respons Farhan soal Kebijakan KDM Kirim Siswa Nakal ke Barak Militer,https://www.detik.com/jabar/berita/d-7898544/respons-farhan-soal-kebijakan-kdm-kirim-siswa-nakal-ke-barak-militer,Gubernur Jabar Dedi Mulyadi kirim siswa nakal ke barak militer untuk pendidikan karakter. Wali Kota Bandung Farhan dukung program ini meski mendapat kritik.,"Minggu, 04 Mei  2025 13:30 WIB",detikJabar,Dedi Mulyadi kirim siswa nakal
Jabar Hari Ini: Babak Baru Ridwan Kamil Vs Lisa Mariana,https://www.detik.com/jabar/berita/d-7902382/jabar-hari-ini-babak-baru-ridwan-kamil-vs-lisa-mariana,"Rangkuman peristiwa di Jawa Barat: Ridwan Kamil digugat, kericuhan demo May Day, nenek Asyah dipukuli, dan sorotan DPRD terhadap program pendidikan karakter.","Selasa, 06 Mei  2025 22:12 WIB",detikJabar,Dedi Mulyadi kirim siswa nakal
Kata Dedi Mulyadi Usai Tinjau Siswa di Barak TNI Purwakarta,https://www.detik.com/jabar/berita/d-7897760/kata-dedi-mulyadi-usai-tinjau-siswa-di-barak-tni-purwakarta,Gubernur Jabar Dedi Mulyadi meninjau pendidikan karakter TNI untuk 39 siswa SMP. Ia melihat perubahan disiplin dan mendukung program untuk kebaikan.,"Sabtu, 03 Mei  2025 15:54 WIB",detikJabar,Dedi Mulyadi kirim siswa nakal
Walkot Singkawang Bakal Kirim Remaja Pelaku Balap Liar ke Kamp TNI,https://www.detik.com/kalimantan/berita/d-7900728/walkot-singkawang-bakal-kirim-remaja-pelaku-balap-liar-ke-kamp-tni,"Wali Kota Singkawang, Tjhai Chui Mie, adopsi kebijakan pelatihan di barak militer untuk remaja pelaku balap liar, fokus pada pembinaan karakter dan disiplin.","Senin, 05 Mei  2025 21:31 WIB",detikKalimantan,Dedi Mulyadi kirim siswa nakal
Komnas HAM Nilai Tak Tepat Siswa Nakal Dikirim ke Barak Militer,https://news.detik.com/berita/d-7896101/komnas-ham-nilai-tak-tepat-siswa-nakal-dikirim-ke-barak-militer,Komnas HAM menilai tidak tepat wacana Gubernur Jabar mengirim siswa bermasalah ke barak militer. Komnas HAM bilang begini.,"Jumat, 02 Mei  2025 14:08 WIB",detikNews,Dedi Mulyadi kirim siswa nakal
"Cianjur Terapkan Jam Malam, Pelajar Terjaring Razia Dikirim ke Barak!",https://www.detik.com/jabar/berita/d-7935749/cianjur-terapkan-jam-malam-pelajar-terjaring-razia-dikirim-ke-barak,Pemerintah Cianjur terapkan jam malam untuk pelajar di bawah 16 tahun. Pelajar yang terjaring razia akan dibina di barak militer untuk mencegah kenakalan.,9 jam yang lalu,detikJabar,barak militer siswa Jawa Barat
Video: KPAI Minta Program Barak Militer Dihentikan Sementara,https://20.detik.com/detikupdate/20250526-250526143/video-kpai-minta-program-barak-militer-dihentikan-sementara,KPAI menyampaikan hasil pengawasan program barak militer untuk anak bermasalah di Jawa Barat. KPAI menemukan sejumlah pelanggaran hak anak dalam program.,"Senin, 26 Mei  2025 22:58 WIB",detikEdu,barak militer siswa Jawa Barat
"Minta Pengiriman Anak Nakal ke Barak Dihentikan, KPAI: Potensi Langgar Hak Anak",https://www.detik.com/sumut/berita/d-7933512/minta-pengiriman-anak-nakal-ke-barak-dihentikan-kpai-potensi-langgar-hak-anak,KPAI minta program Gubernur Jabar yang kirim anak nakal ke barak militer dihentikan. Kebijakan ini dinilai melanggar hak anak dan perlu evaluasi.,"Senin, 26 Mei  2025 23:00 WIB",detikSumut,barak militer siswa Jawa Barat
KDM soal Bobotoh Rusak Rumput GBLA: Pidana atau Barak Militer,https://sport.detik.com/sepakbola/liga-indonesia/d-7932517/kdm-soal-bobotoh-rusak-rumput-gbla-pidana-atau-barak-militer,Gubernur Jawa Barat Dedi Mulyadi mengomentari perusakan rumput Gelora Bandung Lautan Api (GBLA). Ia akan mempidanakan atau memasukkan pelaku ke barak militer.,"Senin, 26 Mei  2025 08:30 WIB",Sepakbola,barak militer siswa Jawa Barat
KPAI Minta Program Anak Nakal Dikirim ke Barak Dihentikan Sementara,https://news.detik.com/berita/d-7933245/kpai-minta-program-anak-nakal-dikirim-ke-barak-dihentikan-sementara,"""Karena dalam surat edaran Pak Gubernur itu kan berpotensi melanggar hak anak. Terutama labelling dan non-diskriminasi,"" ujar Wakil Ketua KPAI Jasra Putra.","Senin, 26 Mei  2025 14:52 WIB",detikNews,barak militer siswa Jawa Barat
"Oknum Bobotoh Rusak GBLA, Dedi Mulyadi: Pidana atau Barak Militer!",https://www.detik.com/jabar/sepakbola/d-7932646/oknum-bobotoh-rusak-gbla-dedi-mulyadi-pidana-atau-barak-militer,Oknum bobotoh merusak Stadion GBLA usai Persib juara Liga 1 2024/2025. Gubernur Dedi Mulyadi menegaskan tidak toleransi terhadap tindakan pengrusakan ini.,"Senin, 26 Mei  2025 10:30 WIB",detikJabar,barak militer siswa Jawa Barat
Haedar Nashir Minta Program Anak Nakal Dikirim ke Barak Dikaji Ulang,https://news.detik.com/berita/d-7931951/haedar-nashir-minta-program-anak-nakal-dikirim-ke-barak-dikaji-ulang,"Ketum PP Muhammadiyah, Haedar Nashir meminta program pengiriman pelajar nakal ke barak militer dikaji ulang.","Minggu, 25 Mei  2025 17:42 WIB",detikNews,barak militer siswa Jawa Barat
Sederet Fakta Oknum Bobotoh Rusak Stadion GBLA,https://www.detik.com/jabar/sepakbola/d-7933892/sederet-fakta-oknum-bobotoh-rusak-stadion-gbla,Oknum bobotoh merusak Stadion GBLA setelah laga Persib vs Persis. Gubernur Dedi Mulyadi perintahkan penyelidikan dan sanksi bagi pelaku.,17 jam yang lalu,detikJabar,barak militer siswa Jawa Barat
Haedar Nashir Minta Program Barak Militer Dedy Mulyadi Dikaji Ulang,https://www.detik.com/jogja/berita/d-7931906/haedar-nashir-minta-program-barak-militer-dedy-mulyadi-dikaji-ulang,Program Gubernur Dedy Mulyani yang mengirim pelajar nakal ke barak militer menuai sorotan. PP Muhammadiyah minta kaji ulang program ini secara akademik.,"Minggu, 25 Mei  2025 17:05 WIB",detikJogja,barak militer siswa Jawa Barat
"Bukan Kirim ke Barak, Kemensos Punya Sentra untuk Tangani Anak 'Nakal'",https://news.detik.com/berita/d-7930314/bukan-kirim-ke-barak-kemensos-punya-sentra-untuk-tangani-anak-nakal,"Wamenos Agus Jabo Priyono mengatakan pihaknya memiliki pendekatan dan sistem sendiri dalam menangani anak-anak yang bermasalah, yakni melalui fasilitas Sentra.","Sabtu, 24 Mei  2025 15:17 WIB",detikNews,barak militer siswa Jawa Barat
Jabar Hari Ini: Pilu Siswi SMP di Garut Dicabuli Pacar,https://www.detik.com/jabar/berita/d-7933691/jabar-hari-ini-pilu-siswi-smp-di-garut-dicabuli-pacar,"Berita hari ini di Jawa Barat: kasus pencabulan di Garut, kerusakan stadion GBLA oleh bobotoh, pergerakan tanah di Tasik, dan jual beli owa di Sukabumi.","Senin, 26 Mei  2025 22:09 WIB",detikJabar,barak militer siswa Jawa Barat
Noda yang Tertinggal Usai Perayaan Persib Juara di GBLA,https://www.detik.com/jabar/berita/d-7934070/noda-yang-tertinggal-usai-perayaan-persib-juara-di-gbla,Euforia juara Persib Bandung ternoda oleh tindakan oknum bobotoh yang merusak Stadion GBLA. Gubernur Dedi Mulyadi mengecam dan minta tindakan tegas.,20 jam yang lalu,detikJabar,barak militer siswa Jawa Barat
Efektivitas Pendidikan Anak di Barak dari Kacamata Pakar Sosiologi,https://www.detik.com/edu/sekolah/d-7928445/efektivitas-pendidikan-anak-di-barak-dari-kacamata-pakar-sosiologi,Kebijakan Gubernur Jabar Dedi Mulyadi soal anak nakal ke barak militer menuai pro-kontra. Pakar sosiologi menilai pendekatan ini berisiko dan kurang efektif.,"Jumat, 23 Mei  2025 13:30 WIB",detikEdu,barak militer siswa Jawa Barat
Video: KPAI Minta Dedi Mulyadi Gelar Pendidikan di Barak Hanya Satu Tahap,https://20.detik.com/detikupdate/20250517-250517051/video-kpai-minta-dedi-mulyadi-gelar-pendidikan-di-barak-hanya-satu-tahap,KPAI minta Mulyadi menggelar pendidikan di barak militer hanya satu tahap. Jasra mengungkap program pendidikan di barak militer sebaiknya dikaji lagi.,"Sabtu, 17 Mei  2025 11:28 WIB",detikEdu,barak militer siswa Jawa Barat
